{
  "$schema": "../schema/archetype-profile.schema.json",
  "profile_id": "ARCH-POLICY-CONTROL-PACK",
  "version": "0.1.0",
  "name": "Policy, governance, or control pack",
  "description": "Requirements, standards, ADR packs, prompts, compliance controls, or governance documents intended to control later execution.",
  "selection": {
    "positive_signals": [
      "policy",
      "control pack",
      "requirements",
      "governance",
      "compliance",
      "ADR",
      "prompt"
    ],
    "exclusion_signals": [
      "the documents are merely explanatory and not controlling"
    ],
    "minimum_confidence_for_primary": 0.6,
    "fallback_profile_id": "ARCH-GENERAL-ENGINEERED-ARTIFACT"
  },
  "stage_metric_weights": {
    "build_package": [
      {
        "metric_id": "BP-001",
        "weight": 18
      },
      {
        "metric_id": "BP-002",
        "weight": 14
      },
      {
        "metric_id": "BP-003",
        "weight": 10
      },
      {
        "metric_id": "BP-004",
        "weight": 12
      },
      {
        "metric_id": "BP-005",
        "weight": 10
      },
      {
        "metric_id": "BP-006",
        "weight": 14
      },
      {
        "metric_id": "BP-007",
        "weight": 10
      },
      {
        "metric_id": "BP-008",
        "weight": 8
      },
      {
        "metric_id": "BP-009",
        "weight": 4
      }
    ],
    "agent_work": [
      {
        "metric_id": "AW-001",
        "weight": 12
      },
      {
        "metric_id": "AW-002",
        "weight": 12
      },
      {
        "metric_id": "AW-003",
        "weight": 12
      },
      {
        "metric_id": "AW-004",
        "weight": 14
      },
      {
        "metric_id": "AW-005",
        "weight": 18
      },
      {
        "metric_id": "AW-006",
        "weight": 10
      },
      {
        "metric_id": "AW-007",
        "weight": 6
      },
      {
        "metric_id": "AW-008",
        "weight": 8
      },
      {
        "metric_id": "AW-009",
        "weight": 8
      }
    ],
    "build_result": [
      {
        "metric_id": "BR-001",
        "weight": 18
      },
      {
        "metric_id": "BR-002",
        "weight": 2
      },
      {
        "metric_id": "BR-003",
        "weight": 14
      },
      {
        "metric_id": "BR-004",
        "weight": 16
      },
      {
        "metric_id": "BR-005",
        "weight": 10
      },
      {
        "metric_id": "BR-006",
        "weight": 16
      },
      {
        "metric_id": "BR-007",
        "weight": 4
      },
      {
        "metric_id": "BR-008",
        "weight": 8
      },
      {
        "metric_id": "BR-009",
        "weight": 8
      },
      {
        "metric_id": "BR-010",
        "weight": 4
      }
    ]
  },
  "common_axis_profile": "metrics/metric-bank.json#common_axes",
  "primary_risks": [
    "ambiguous obligation",
    "conflicting authority",
    "non-operational controls",
    "self-referential acceptance"
  ],
  "mandatory_evidence": {
    "build_package": [
      "authority order",
      "atomic obligations",
      "verdict rules"
    ],
    "agent_work": [
      "authority resolution",
      "obligation coverage",
      "deviation record"
    ],
    "build_result": [
      "cross-document consistency",
      "machine/human alignment",
      "control executability"
    ]
  },
  "applicable_problem_ids": [
    "PROB-003",
    "PROB-009",
    "PROB-012",
    "PROB-013",
    "PROB-020",
    "PROB-023"
  ],
  "drift_dimensions": [
    "DRIFT-GOAL",
    "DRIFT-SCOPE",
    "DRIFT-SEMANTIC",
    "DRIFT-CONTRACT",
    "DRIFT-STRUCTURE",
    "DRIFT-EVIDENCE",
    "DRIFT-VALIDATOR",
    "DRIFT-REPRO",
    "DRIFT-DEPENDENCY",
    "DRIFT-DISCIPLINE"
  ],
  "proof_policy": {
    "bounded_claim_rule": "A proof demonstrates only the claims exercised by its oracle.",
    "fixture_pass_is_release_pass": false,
    "require_final_artifact_origin": false
  }
}
