{
  "$schema": "../schema/archetype-profile.schema.json",
  "profile_id": "ARCH-SOFTWARE-APPLICATION-SERVICE",
  "version": "0.1.0",
  "name": "Software application or service",
  "description": "Deployable application, API, web service, desktop application, or end-user executable.",
  "selection": {
    "positive_signals": [
      "service",
      "application",
      "API",
      "deployment",
      "endpoint",
      "user workflow"
    ],
    "exclusion_signals": [
      "only a reusable library is delivered"
    ],
    "minimum_confidence_for_primary": 0.6,
    "fallback_profile_id": "ARCH-GENERAL-ENGINEERED-ARTIFACT"
  },
  "stage_metric_weights": {
    "build_package": [
      {
        "metric_id": "BP-001",
        "weight": 14
      },
      {
        "metric_id": "BP-002",
        "weight": 10
      },
      {
        "metric_id": "BP-003",
        "weight": 8
      },
      {
        "metric_id": "BP-004",
        "weight": 12
      },
      {
        "metric_id": "BP-005",
        "weight": 18
      },
      {
        "metric_id": "BP-006",
        "weight": 10
      },
      {
        "metric_id": "BP-007",
        "weight": 8
      },
      {
        "metric_id": "BP-008",
        "weight": 12
      },
      {
        "metric_id": "BP-009",
        "weight": 8
      }
    ],
    "agent_work": [
      {
        "metric_id": "AW-001",
        "weight": 8
      },
      {
        "metric_id": "AW-002",
        "weight": 10
      },
      {
        "metric_id": "AW-003",
        "weight": 8
      },
      {
        "metric_id": "AW-004",
        "weight": 14
      },
      {
        "metric_id": "AW-005",
        "weight": 12
      },
      {
        "metric_id": "AW-006",
        "weight": 20
      },
      {
        "metric_id": "AW-007",
        "weight": 12
      },
      {
        "metric_id": "AW-008",
        "weight": 8
      },
      {
        "metric_id": "AW-009",
        "weight": 8
      }
    ],
    "build_result": [
      {
        "metric_id": "BR-001",
        "weight": 12
      },
      {
        "metric_id": "BR-002",
        "weight": 20
      },
      {
        "metric_id": "BR-003",
        "weight": 10
      },
      {
        "metric_id": "BR-004",
        "weight": 6
      },
      {
        "metric_id": "BR-005",
        "weight": 6
      },
      {
        "metric_id": "BR-006",
        "weight": 8
      },
      {
        "metric_id": "BR-007",
        "weight": 12
      },
      {
        "metric_id": "BR-008",
        "weight": 14
      },
      {
        "metric_id": "BR-009",
        "weight": 8
      },
      {
        "metric_id": "BR-010",
        "weight": 4
      }
    ]
  },
  "common_axis_profile": "metrics/metric-bank.json#common_axes",
  "primary_risks": [
    "functional regression",
    "integration failure",
    "unsafe failure behavior",
    "environment-dependent replay"
  ],
  "mandatory_evidence": {
    "build_package": [
      "functional acceptance criteria",
      "integration boundaries",
      "failure behavior"
    ],
    "agent_work": [
      "test execution logs",
      "deployment or run trace",
      "negative tests"
    ],
    "build_result": [
      "end-to-end tests",
      "interface compatibility",
      "clean deployment or startup proof"
    ]
  },
  "applicable_problem_ids": [
    "PROB-001",
    "PROB-004",
    "PROB-014",
    "PROB-019",
    "PROB-022"
  ],
  "drift_dimensions": [
    "DRIFT-GOAL",
    "DRIFT-SCOPE",
    "DRIFT-SEMANTIC",
    "DRIFT-CONTRACT",
    "DRIFT-STRUCTURE",
    "DRIFT-EVIDENCE",
    "DRIFT-VALIDATOR",
    "DRIFT-REPRO",
    "DRIFT-DEPENDENCY",
    "DRIFT-DISCIPLINE"
  ],
  "proof_policy": {
    "bounded_claim_rule": "A proof demonstrates only the claims exercised by its oracle.",
    "fixture_pass_is_release_pass": false,
    "require_final_artifact_origin": true
  }
}
