{
  "$schema": "../schema/archetype-profile.schema.json",
  "profile_id": "ARCH-INFRASTRUCTURE-PLATFORM",
  "version": "0.1.0",
  "name": "Infrastructure or platform",
  "description": "Infrastructure-as-code, platform configuration, deployment topology, cluster, cloud, or environment definition.",
  "selection": {
    "positive_signals": [
      "infrastructure",
      "Terraform",
      "Kubernetes",
      "deployment topology",
      "environment",
      "platform"
    ],
    "exclusion_signals": [
      "no deployed environment or operational configuration"
    ],
    "minimum_confidence_for_primary": 0.6,
    "fallback_profile_id": "ARCH-GENERAL-ENGINEERED-ARTIFACT"
  },
  "stage_metric_weights": {
    "build_package": [
      {
        "metric_id": "BP-001",
        "weight": 12
      },
      {
        "metric_id": "BP-002",
        "weight": 12
      },
      {
        "metric_id": "BP-003",
        "weight": 8
      },
      {
        "metric_id": "BP-004",
        "weight": 14
      },
      {
        "metric_id": "BP-005",
        "weight": 18
      },
      {
        "metric_id": "BP-006",
        "weight": 10
      },
      {
        "metric_id": "BP-007",
        "weight": 8
      },
      {
        "metric_id": "BP-008",
        "weight": 12
      },
      {
        "metric_id": "BP-009",
        "weight": 6
      }
    ],
    "agent_work": [
      {
        "metric_id": "AW-001",
        "weight": 8
      },
      {
        "metric_id": "AW-002",
        "weight": 10
      },
      {
        "metric_id": "AW-003",
        "weight": 8
      },
      {
        "metric_id": "AW-004",
        "weight": 14
      },
      {
        "metric_id": "AW-005",
        "weight": 14
      },
      {
        "metric_id": "AW-006",
        "weight": 18
      },
      {
        "metric_id": "AW-007",
        "weight": 14
      },
      {
        "metric_id": "AW-008",
        "weight": 8
      },
      {
        "metric_id": "AW-009",
        "weight": 6
      }
    ],
    "build_result": [
      {
        "metric_id": "BR-001",
        "weight": 10
      },
      {
        "metric_id": "BR-002",
        "weight": 18
      },
      {
        "metric_id": "BR-003",
        "weight": 12
      },
      {
        "metric_id": "BR-004",
        "weight": 6
      },
      {
        "metric_id": "BR-005",
        "weight": 10
      },
      {
        "metric_id": "BR-006",
        "weight": 8
      },
      {
        "metric_id": "BR-007",
        "weight": 16
      },
      {
        "metric_id": "BR-008",
        "weight": 14
      },
      {
        "metric_id": "BR-009",
        "weight": 4
      },
      {
        "metric_id": "BR-010",
        "weight": 2
      }
    ]
  },
  "common_axis_profile": "metrics/metric-bank.json#common_axes",
  "primary_risks": [
    "environment drift",
    "non-idempotent deployment",
    "secret leakage",
    "rollback failure",
    "provider-version drift"
  ],
  "mandatory_evidence": {
    "build_package": [
      "environment baseline",
      "rollback and safety gates",
      "dependency lock policy"
    ],
    "agent_work": [
      "plan/apply outputs",
      "state change trace",
      "rollback or dry-run evidence"
    ],
    "build_result": [
      "clean environment deployment",
      "idempotence check",
      "state and dependency verification"
    ]
  },
  "applicable_problem_ids": [
    "PROB-001",
    "PROB-006",
    "PROB-009",
    "PROB-017",
    "PROB-019",
    "PROB-022"
  ],
  "drift_dimensions": [
    "DRIFT-GOAL",
    "DRIFT-SCOPE",
    "DRIFT-SEMANTIC",
    "DRIFT-CONTRACT",
    "DRIFT-STRUCTURE",
    "DRIFT-EVIDENCE",
    "DRIFT-VALIDATOR",
    "DRIFT-REPRO",
    "DRIFT-DEPENDENCY",
    "DRIFT-DISCIPLINE"
  ],
  "proof_policy": {
    "bounded_claim_rule": "A proof demonstrates only the claims exercised by its oracle.",
    "fixture_pass_is_release_pass": false,
    "require_final_artifact_origin": true
  }
}
