{
  "$schema": "../schema/archetype-profile.schema.json",
  "profile_id": "ARCH-ML-AGENT-SYSTEM",
  "version": "0.1.0",
  "name": "ML, LLM, or autonomous-agent system",
  "description": "Model, prompt-driven agent, evaluation harness, retrieval system, or autonomous workflow with probabilistic behavior.",
  "selection": {
    "positive_signals": [
      "model",
      "LLM",
      "agent",
      "prompt",
      "evaluation set",
      "retrieval",
      "tool use"
    ],
    "exclusion_signals": [
      "fully deterministic software with no learned or generative component"
    ],
    "minimum_confidence_for_primary": 0.6,
    "fallback_profile_id": "ARCH-GENERAL-ENGINEERED-ARTIFACT"
  },
  "stage_metric_weights": {
    "build_package": [
      {
        "metric_id": "BP-001",
        "weight": 14
      },
      {
        "metric_id": "BP-002",
        "weight": 10
      },
      {
        "metric_id": "BP-003",
        "weight": 6
      },
      {
        "metric_id": "BP-004",
        "weight": 16
      },
      {
        "metric_id": "BP-005",
        "weight": 16
      },
      {
        "metric_id": "BP-006",
        "weight": 12
      },
      {
        "metric_id": "BP-007",
        "weight": 10
      },
      {
        "metric_id": "BP-008",
        "weight": 12
      },
      {
        "metric_id": "BP-009",
        "weight": 4
      }
    ],
    "agent_work": [
      {
        "metric_id": "AW-001",
        "weight": 10
      },
      {
        "metric_id": "AW-002",
        "weight": 8
      },
      {
        "metric_id": "AW-003",
        "weight": 8
      },
      {
        "metric_id": "AW-004",
        "weight": 12
      },
      {
        "metric_id": "AW-005",
        "weight": 18
      },
      {
        "metric_id": "AW-006",
        "weight": 16
      },
      {
        "metric_id": "AW-007",
        "weight": 12
      },
      {
        "metric_id": "AW-008",
        "weight": 10
      },
      {
        "metric_id": "AW-009",
        "weight": 6
      }
    ],
    "build_result": [
      {
        "metric_id": "BR-001",
        "weight": 12
      },
      {
        "metric_id": "BR-002",
        "weight": 16
      },
      {
        "metric_id": "BR-003",
        "weight": 10
      },
      {
        "metric_id": "BR-004",
        "weight": 10
      },
      {
        "metric_id": "BR-005",
        "weight": 6
      },
      {
        "metric_id": "BR-006",
        "weight": 14
      },
      {
        "metric_id": "BR-007",
        "weight": 10
      },
      {
        "metric_id": "BR-008",
        "weight": 14
      },
      {
        "metric_id": "BR-009",
        "weight": 6
      },
      {
        "metric_id": "BR-010",
        "weight": 2
      }
    ]
  },
  "common_axis_profile": "metrics/metric-bank.json#common_axes",
  "primary_risks": [
    "benchmark overfitting",
    "evaluation contamination",
    "non-deterministic evidence",
    "unsafe tool behavior",
    "prompt drift"
  ],
  "mandatory_evidence": {
    "build_package": [
      "evaluation set policy",
      "model/prompt baseline",
      "risk and safety gates"
    ],
    "agent_work": [
      "run configuration",
      "seed/model version",
      "failure examples",
      "tool traces"
    ],
    "build_result": [
      "held-out evaluation",
      "repeat-run variance",
      "adversarial tests",
      "safety behavior"
    ]
  },
  "applicable_problem_ids": [
    "PROB-001",
    "PROB-004",
    "PROB-005",
    "PROB-013",
    "PROB-014",
    "PROB-022"
  ],
  "drift_dimensions": [
    "DRIFT-GOAL",
    "DRIFT-SCOPE",
    "DRIFT-SEMANTIC",
    "DRIFT-CONTRACT",
    "DRIFT-STRUCTURE",
    "DRIFT-EVIDENCE",
    "DRIFT-VALIDATOR",
    "DRIFT-REPRO",
    "DRIFT-DEPENDENCY",
    "DRIFT-DISCIPLINE"
  ],
  "proof_policy": {
    "bounded_claim_rule": "A proof demonstrates only the claims exercised by its oracle.",
    "fixture_pass_is_release_pass": false,
    "require_final_artifact_origin": true
  }
}
