{
  "$schema": "../schema/archetype-profile.schema.json",
  "profile_id": "ARCH-MULTI-ARTIFACT-PROFILE-RUNTIME",
  "version": "0.1.0",
  "name": "Profile plus runtime bootstrap package",
  "description": "A package that defines a profile or contract and also claims to execute, generate, validate, or bootstrap downstream artifacts.",
  "selection": {
    "positive_signals": [
      "execution skill",
      "runtime profile",
      "bootstrap proof",
      "downstream package",
      "reflection iteration",
      "replay"
    ],
    "exclusion_signals": [
      "no executable or generative behavior is claimed"
    ],
    "minimum_confidence_for_primary": 0.6,
    "fallback_profile_id": "ARCH-GENERAL-ENGINEERED-ARTIFACT"
  },
  "stage_metric_weights": {
    "build_package": [
      {
        "metric_id": "BP-001",
        "weight": 12
      },
      {
        "metric_id": "BP-002",
        "weight": 10
      },
      {
        "metric_id": "BP-003",
        "weight": 8
      },
      {
        "metric_id": "BP-004",
        "weight": 14
      },
      {
        "metric_id": "BP-005",
        "weight": 16
      },
      {
        "metric_id": "BP-006",
        "weight": 12
      },
      {
        "metric_id": "BP-007",
        "weight": 10
      },
      {
        "metric_id": "BP-008",
        "weight": 12
      },
      {
        "metric_id": "BP-009",
        "weight": 6
      }
    ],
    "agent_work": [
      {
        "metric_id": "AW-001",
        "weight": 10
      },
      {
        "metric_id": "AW-002",
        "weight": 10
      },
      {
        "metric_id": "AW-003",
        "weight": 8
      },
      {
        "metric_id": "AW-004",
        "weight": 12
      },
      {
        "metric_id": "AW-005",
        "weight": 14
      },
      {
        "metric_id": "AW-006",
        "weight": 16
      },
      {
        "metric_id": "AW-007",
        "weight": 16
      },
      {
        "metric_id": "AW-008",
        "weight": 8
      },
      {
        "metric_id": "AW-009",
        "weight": 6
      }
    ],
    "build_result": [
      {
        "metric_id": "BR-001",
        "weight": 10
      },
      {
        "metric_id": "BR-002",
        "weight": 12
      },
      {
        "metric_id": "BR-003",
        "weight": 12
      },
      {
        "metric_id": "BR-004",
        "weight": 10
      },
      {
        "metric_id": "BR-005",
        "weight": 8
      },
      {
        "metric_id": "BR-006",
        "weight": 10
      },
      {
        "metric_id": "BR-007",
        "weight": 16
      },
      {
        "metric_id": "BR-008",
        "weight": 12
      },
      {
        "metric_id": "BR-009",
        "weight": 6
      },
      {
        "metric_id": "BR-010",
        "weight": 4
      }
    ]
  },
  "common_axis_profile": "metrics/metric-bank.json#common_axes",
  "primary_risks": [
    "fixture overfitting",
    "proof built outside final artifact",
    "circular validation",
    "profile/runtime divergence"
  ],
  "mandatory_evidence": {
    "build_package": [
      "runtime boundary",
      "proof obligations",
      "clean-extraction replay command",
      "profile compliance oracle"
    ],
    "agent_work": [
      "final-artifact replay trace",
      "proof artifact hashes",
      "separate profile and function checks"
    ],
    "build_result": [
      "package-local replay capability",
      "two clean-environment runs",
      "proof inventory and negative tests"
    ]
  },
  "applicable_problem_ids": [
    "PROB-001",
    "PROB-004",
    "PROB-005",
    "PROB-006",
    "PROB-014",
    "PROB-021",
    "PROB-022"
  ],
  "drift_dimensions": [
    "DRIFT-GOAL",
    "DRIFT-SCOPE",
    "DRIFT-SEMANTIC",
    "DRIFT-CONTRACT",
    "DRIFT-STRUCTURE",
    "DRIFT-EVIDENCE",
    "DRIFT-VALIDATOR",
    "DRIFT-REPRO",
    "DRIFT-DEPENDENCY",
    "DRIFT-DISCIPLINE"
  ],
  "proof_policy": {
    "bounded_claim_rule": "A proof demonstrates only the claims exercised by its oracle.",
    "fixture_pass_is_release_pass": false,
    "require_final_artifact_origin": true
  }
}
